{
  "catalog_id": "absorber-families",
  "catalog_version": "v0.1.0",
  "schema_ref": "absorber-family.schema.json",
  "spec_ref": "model-extension-2-spec-v0.2.1-§7-§17.2",
  "description": "Conservative generic absorber family starter entries for Extension 2 exploratory mode. All entries are generic. Values are conservative estimates for trade space exploration only. Do not treat as measured material performance or flight qualification.",
  "entries": [
    {
      "absorber_family_id": "broadband_mid_ir_generic",
      "label": "Broadband Mid-IR Absorber (Generic)",
      "absorber_class": "broadband_mid_ir_absorber",
      "wavelength_band_min_um": 3.0,
      "wavelength_band_nominal_um": 8.0,
      "wavelength_band_max_um": 14.0,
      "nominal_absorptivity": 0.85,
      "nominal_emissivity": 0.85,
      "temperature_min_k": 250,
      "temperature_nominal_k": 400,
      "temperature_max_k": 700,
      "contamination_sensitivity": "moderate",
      "corrosion_sensitivity": "low",
      "radiation_sensitivity": "moderate",
      "surface_state_class": "stable_at_nominal",
      "provenance_class": "literature_derived",
      "maturity_class": "heritage_analog",
      "confidence_class": "medium",
      "output_effect_class": "output_driving",
      "default_enabled_for_exploration": true,
      "notes": [
        "Represents a generic high-emissivity mid-IR coating class. Absorptivity and emissivity are similar for broadband non-selective surfaces (Kirchhoff balance near unity). Conservative estimate for trade use.",
        "Actual coating performance depends on specific material, substrate preparation, and operating temperature. Do not use for design commitment without bench characterization."
      ],
      "research_required": false
    },
    {
      "absorber_family_id": "narrowband_mid_ir_generic",
      "label": "Narrowband Mid-IR Absorber (Generic)",
      "absorber_class": "narrowband_mid_ir_absorber",
      "wavelength_band_min_um": 7.5,
      "wavelength_band_nominal_um": 8.5,
      "wavelength_band_max_um": 10.0,
      "nominal_absorptivity": 0.75,
      "nominal_emissivity": 0.4,
      "temperature_min_k": 280,
      "temperature_nominal_k": 380,
      "temperature_max_k": 600,
      "contamination_sensitivity": "high",
      "corrosion_sensitivity": "moderate",
      "radiation_sensitivity": "high",
      "surface_state_class": "sensitive_to_surface_state",
      "provenance_class": "analog_estimated",
      "maturity_class": "modeled_only",
      "confidence_class": "low",
      "output_effect_class": "output_driving",
      "default_enabled_for_exploration": true,
      "notes": [
        "Represents the concept of a narrowband selective absorber tuned to the 8–10 µm range. Selectivity claims (high absorptivity, low emissivity in out-of-band region) are concept-level only for generic entry.",
        "Real narrowband selective absorbers require detailed spectral characterization. Values are placeholder-adjacent; treat as directional only."
      ],
      "research_required": true
    },
    {
      "absorber_family_id": "ceramic_selective_absorber_generic",
      "label": "Ceramic Selective Absorber (Generic)",
      "absorber_class": "ceramic_selective_absorber",
      "wavelength_band_min_um": 2.5,
      "wavelength_band_nominal_um": 4.0,
      "wavelength_band_max_um": 6.0,
      "nominal_absorptivity": 0.80,
      "nominal_emissivity": 0.35,
      "temperature_min_k": 400,
      "temperature_nominal_k": 800,
      "temperature_max_k": 1200,
      "contamination_sensitivity": "moderate",
      "corrosion_sensitivity": "low",
      "radiation_sensitivity": "low",
      "surface_state_class": "thermally_stable",
      "provenance_class": "literature_derived",
      "maturity_class": "bench_evidence",
      "confidence_class": "medium",
      "output_effect_class": "output_driving",
      "default_enabled_for_exploration": false,
      "notes": [
        "Ceramic emitter/absorber materials (e.g. SiC, BN composites, rare-earth oxides) have been demonstrated to exhibit selective emissivity behavior in the mid-IR. Values are representative of a generic class, not a specific commercial coating.",
        "High-temperature operating range is relevant for hot-island and regen-store applications. Radiation stability noted as low sensitivity based on heritage refractory ceramic analogs."
      ],
      "research_required": false
    },
    {
      "absorber_family_id": "refractory_receiver_surface_generic",
      "label": "Refractory Receiver Surface (Generic)",
      "absorber_class": "refractory_receiver_surface",
      "wavelength_band_min_um": 1.0,
      "wavelength_band_nominal_um": 3.0,
      "wavelength_band_max_um": 6.0,
      "nominal_absorptivity": 0.88,
      "nominal_emissivity": 0.80,
      "temperature_min_k": 600,
      "temperature_nominal_k": 1000,
      "temperature_max_k": 1500,
      "contamination_sensitivity": "low",
      "corrosion_sensitivity": "low",
      "radiation_sensitivity": "low",
      "surface_state_class": "thermally_stable",
      "provenance_class": "literature_derived",
      "maturity_class": "heritage_analog",
      "confidence_class": "medium",
      "output_effect_class": "output_driving",
      "default_enabled_for_exploration": false,
      "notes": [
        "Refractory ceramics and carbon-based receiver surfaces are used in concentrating solar and high-temperature process systems. Values represent generic refractory absorber behavior.",
        "Applicable to hot-island and solar-polish scenarios only. At these temperatures, radiative emission becomes significant; net thermal gain requires careful geometry accounting."
      ],
      "research_required": false
    }
  ]
}
